{
  "schemaVersion": 1,
  "releaseVersion": "2026.09.0",
  "generatedAt": "2026-09-20T00:00:00Z",
  "source": {"provider": "OpenStreetMap", "license": "ODbL-1.0"},
  "maps": [
    {"id":"brasil-base","name":"Brasil","kind":"national","available":false,"version":null,"asset":null,"size":null,"sha256":null,"minZoom":0,"maxZoom":7,"bounds":[-74.0,-33.8,-34.7,5.3],"sourceDate":null},
    {"id":"ac","name":"Acre","kind":"state","available":false,"version":null,"asset":null,"size":null,"sha256":null,"minZoom":7,"maxZoom":14,"bounds":[-74.0,-11.2,-66.5,-7.0],"sourceDate":null},
    {"id":"al","name":"Alagoas","kind":"state","available":false,"version":null,"asset":null,"size":null,"sha256":null,"minZoom":7,"maxZoom":14,"bounds":[-36.7,-10.6,-35.1,-8.8],"sourceDate":null},
    {"id":"ap","name":"Amapá","kind":"state","available":false,"version":null,"asset":null,"size":null,"sha256":null,"minZoom":7,"maxZoom":14,"bounds":[-54.0,-1.3,-49.7,4.5],"sourceDate":null},
    {"id":"am","name":"Amazonas","kind":"state","available":false,"version":null,"asset":null,"size":null,"sha256":null,"minZoom":7,"maxZoom":14,"bounds":[-73.8,-9.9,-56.0,2.3],"sourceDate":null},
    {"id":"ba","name":"Bahia","kind":"state","available":false,"version":null,"asset":null,"size":null,"sha256":null,"minZoom":7,"maxZoom":14,"bounds":[-46.7,-18.4,-37.2,-8.5],"sourceDate":null},
    {"id":"ce","name":"Ceará","kind":"state","available":false,"version":null,"asset":null,"size":null,"sha256":null,"minZoom":7,"maxZoom":14,"bounds":[-41.5,-7.9,-37.2,-2.7],"sourceDate":null},
    {"id":"df","name":"Distrito Federal","kind":"federal-district","available":false,"version":null,"asset":null,"size":null,"sha256":null,"minZoom":7,"maxZoom":14,"bounds":[-48.3,-16.1,-47.3,-15.5],"sourceDate":null},
    {"id":"es","name":"Espírito Santo","kind":"state","available":false,"version":null,"asset":null,"size":null,"sha256":null,"minZoom":7,"maxZoom":14,"bounds":[-41.9,-21.4,-39.7,-17.9],"sourceDate":null},
    {"id":"go","name":"Goiás","kind":"state","available":false,"version":null,"asset":null,"size":null,"sha256":null,"minZoom":7,"maxZoom":14,"bounds":[-53.3,-19.5,-45.9,-12.4],"sourceDate":null},
    {"id":"ma","name":"Maranhão","kind":"state","available":false,"version":null,"asset":null,"size":null,"sha256":null,"minZoom":7,"maxZoom":14,"bounds":[-48.0,-10.3,-41.8,-1.0],"sourceDate":null},
    {"id":"mt","name":"Mato Grosso","kind":"state","available":false,"version":null,"asset":null,"size":null,"sha256":null,"minZoom":7,"maxZoom":14,"bounds":[-61.7,-18.1,-50.2,-7.3],"sourceDate":null},
    {"id":"ms","name":"Mato Grosso do Sul","kind":"state","available":false,"version":null,"asset":null,"size":null,"sha256":null,"minZoom":7,"maxZoom":14,"bounds":[-58.3,-24.1,-50.9,-17.2],"sourceDate":null},
    {"id":"mg","name":"Minas Gerais","kind":"state","available":false,"version":null,"asset":null,"size":null,"sha256":null,"minZoom":7,"maxZoom":14,"bounds":[-51.1,-23.0,-39.8,-14.2],"sourceDate":null},
    {"id":"pa","name":"Pará","kind":"state","available":false,"version":null,"asset":null,"size":null,"sha256":null,"minZoom":7,"maxZoom":14,"bounds":[-58.9,-9.9,-46.0,2.6],"sourceDate":null},
    {"id":"pb","name":"Paraíba","kind":"state","available":false,"version":null,"asset":null,"size":null,"sha256":null,"minZoom":7,"maxZoom":14,"bounds":[-38.8,-8.4,-34.8,-6.0],"sourceDate":null},
    {"id":"pr","name":"Paraná","kind":"state","available":false,"version":null,"asset":null,"size":null,"sha256":null,"minZoom":7,"maxZoom":14,"bounds":[-54.7,-26.8,-48.0,-22.5],"sourceDate":null},
    {"id":"pe","name":"Pernambuco","kind":"state","available":false,"version":null,"asset":null,"size":null,"sha256":null,"minZoom":7,"maxZoom":14,"bounds":[-41.4,-9.6,-34.8,-7.1],"sourceDate":null},
    {"id":"pi","name":"Piauí","kind":"state","available":false,"version":null,"asset":null,"size":null,"sha256":null,"minZoom":7,"maxZoom":14,"bounds":[-45.9,-10.9,-40.4,-2.7],"sourceDate":null},
    {"id":"rj","name":"Rio de Janeiro","kind":"state","available":false,"version":null,"asset":null,"size":null,"sha256":null,"minZoom":7,"maxZoom":14,"bounds":[-44.9,-23.4,-40.9,-20.7],"sourceDate":null},
    {"id":"rn","name":"Rio Grande do Norte","kind":"state","available":false,"version":null,"asset":null,"size":null,"sha256":null,"minZoom":7,"maxZoom":14,"bounds":[-38.6,-7.0,-34.9,-4.8],"sourceDate":null},
    {"id":"rs","name":"Rio Grande do Sul","kind":"state","available":false,"version":null,"asset":null,"size":null,"sha256":null,"minZoom":7,"maxZoom":14,"bounds":[-57.7,-33.8,-49.7,-27.1],"sourceDate":null},
    {"id":"ro","name":"Rondônia","kind":"state","available":false,"version":null,"asset":null,"size":null,"sha256":null,"minZoom":7,"maxZoom":14,"bounds":[-66.7,-13.7,-59.8,-7.9],"sourceDate":null},
    {"id":"rr","name":"Roraima","kind":"state","available":false,"version":null,"asset":null,"size":null,"sha256":null,"minZoom":7,"maxZoom":14,"bounds":[-64.9,0.9,-58.8,5.3],"sourceDate":null},
    {"id":"sc","name":"Santa Catarina","kind":"state","available":false,"version":null,"asset":null,"size":null,"sha256":null,"minZoom":7,"maxZoom":14,"bounds":[-53.9,-29.4,-48.3,-25.8],"sourceDate":null},
    {"id":"sp","name":"São Paulo","kind":"state","available":false,"version":null,"asset":null,"size":null,"sha256":null,"minZoom":7,"maxZoom":14,"bounds":[-53.2,-25.4,-44.1,-19.7],"sourceDate":null},
    {"id":"se","name":"Sergipe","kind":"state","available":false,"version":null,"asset":null,"size":null,"sha256":null,"minZoom":7,"maxZoom":14,"bounds":[-38.3,-11.6,-36.3,-9.5],"sourceDate":null},
    {"id":"to","name":"Tocantins","kind":"state","available":false,"version":null,"asset":null,"size":null,"sha256":null,"minZoom":7,"maxZoom":14,"bounds":[-50.8,-13.5,-45.7,-5.2],"sourceDate":null}
  ]
}
